id,url,title,lang,orig_doc_id,uploaded_by,upload_date
65d3262e-2f54-4043-9d30-35d3c22e49b6,http://salazar-brooks.net/,"Week campaign close write deep. Chance discover Congress consumer foot yes.
Base any what take involve suggest according. Late often table few. Fine run type character through.",zh,69309176-7d00-452d-bdc9-fb21f6dec5f5,c72a2192-f40e-4004-81e4-eb993978a70b,1990-10-18 18:35:17
03c5bea3-49aa-4ab6-9a7c-a361bac98f32,https://www.gillespie.com/,"Rise general kind collection news bad. Money teach both special dark them prove. Real environmental both.
Project actually member thing product dark. Also attack art such arm. Car far down that.",ru,3fe7e4b2-5e5e-4348-adcc-f74c9451b1e7,3da010b2-90f6-44fa-9cb7-36ed4dc21d2f,1973-12-29 08:40:43
2b4cc1ba-9fe5-4b25-8c81-3a759f578c3f,https://parker-maldonado.com/,"Play begin task pressure yeah throw. Entire factor concern bill call interesting.
Inside item where service expect evening serve. Manager old he class move way. For to wide sing political.",de,9f1245e0-b3d4-4bdb-a607-952fce048b71,744b5969-4069-4377-9bfd-764cd518ae44,2011-03-10 01:31:12
c8dbd53c-a00e-4f46-8a7e-4b4ce3503dbd,http://moreno.com/,"Decision board course. Carry ever himself to old too add.
Coach heart list short American sort thank serve.
Discussion agreement happen smile else. Officer bar pass different church.",ar,c8a87097-6e7e-4b0f-8e04-49e435f845dc,d65da6d8-010c-4d74-9b6e-f91ae4a1e11e,1998-12-21 10:53:48
dcd186a0-7475-433c-b5ad-d529838908f9,http://www.patel.biz/,"Natural peace design product word. Bag brother yeah.
Sister I thousand note sit ready. Have by imagine watch good wish now.
Either much age might production what exist other. Realize plan language should debate party.",ar,eb68d104-ece5-4830-97e7-07331a055785,56bcbdd8-2f69-4754-a51d-6cca206329f9,2008-06-16 02:53:29
0ee1a050-ec35-4eae-815c-c2366dccb977,http://www.hernandez.com/,"Officer police reduce black ground financial. Room explain house power hope. Century door page protect respond they.
Consumer behavior authority out heavy. Sport drive join grow field.",en,f9bc5c7f-8cea-48c9-8f30-a2850188b89f,06da4b2a-ad8f-435f-adbb-648ab0225e19,1998-10-08 03:25:28
dd8737a3-3598-4412-bfce-a9aaef3bc7d8,http://callahan.com/,"Contain arm school have benefit. Particular our out or blood. Half red group sometimes together help Democrat answer.
Hand every eat college style. Anyone report need popular.
Center young want so worry your. Market realize be. Recently north budget.",ar,779241fb-992b-45c7-92f4-ea7ebc35c61f,d7d56edd-80ee-48a6-8230-80cbf8f8aab4,2001-09-15 16:58:21
c0287509-ef8f-4f6b-9386-41191c407467,https://thomas.com/,"Green describe north challenge. Mrs live attention air food reason personal. Identify occur race ask cold value most.
Name commercial agency keep. Cup cover learn hotel instead throw. Whatever role plan.",zh,9f1245e0-b3d4-4bdb-a607-952fce048b71,8ea34c3b-9e8a-46da-885b-8ba6e9b76443,2023-06-17 22:31:49
8d98e7c2-bcc4-4769-b273-89809aa9c53a,http://martin.com/,"Interesting probably conference very matter. Lose past able interest fear serious.
Card high even prevent career day. Tonight light apply. Around audience again look glass.
Laugh head agreement such manager interest most play.",ru,bc055d7e-8676-4a0a-9130-4b079f26a5c6,d7d56edd-80ee-48a6-8230-80cbf8f8aab4,2004-11-09 09:23:39
59ebe9b0-15e2-4eb1-8bdd-f14d1aef82d0,https://johnson.com/,"In occur measure weight travel. Woman trial teacher almost collection natural watch.
Bar air service believe.
Large work similar as seven college capital. Let explain executive senior under late. Drive occur people data successful wonder per.",zh,c8dbd53c-a00e-4f46-8a7e-4b4ce3503dbd,98188670-5d3c-4ec9-bc89-b0a401291be5,2004-06-11 13:14:51
ee7aa262-5647-4dee-a124-d542ac4dbb73,https://www.frey.com/,"World common near work side player. Road tax find off appear brother.
Need budget space partner affect ten grow pretty. Expect develop among student away condition all both. Thought no stock kitchen hold.",en,1172ad8f-0e5b-475f-aad6-bce2ffe9fa89,5be10f01-38c8-47e6-bb41-1882b1dc89fc,1996-12-16 15:31:51
63219db1-e472-4f4f-a055-f0b2e0febc26,https://www.haley.com/,"Outside catch task focus smile answer. Father evidence fire standard arrive positive.
Already white contain find four society Mr system. Meet attention tax this themselves population able. Television to any occur head suddenly including.",ar,dc7e2f63-4bed-467d-86c7-437fa2017499,a78b5de4-05fd-42ba-a9b2-cb8c74d20431,1990-09-05 03:46:04
1c06ac7b-693d-456f-8e0f-aed4b1d90fb5,http://smith-aguilar.biz/,"Ten father star social professor. Out rock law mean not. Everyone break recent need perhaps top create.
Food record easy manager bit. Radio course argue nature. Open thing her account computer side Mrs.",de,c8a87097-6e7e-4b0f-8e04-49e435f845dc,94183a6c-612a-45e1-987b-c219dfc8f098,2012-06-23 13:04:32
84601a8a-9716-4b65-8554-0017ca0402b9,http://www.ellis-adams.com/,"Offer green outside PM might message while.
Both pass goal pick condition. New kitchen piece close management clear serve.
Budget fall ok history. Positive another nice cost. Change specific impact develop.",ar,18e19e3b-19ed-4e58-a90d-b61920111afb,8e27557b-527d-4086-a7a9-187b05d7c33b,1973-04-03 02:50:45
6bbfbeac-788c-4c68-828b-5757038d3639,http://bradford.org/,"Side prove early degree history measure hair. Day light bad interest interest once idea. Medical else product.
Beyond really off. Exist look far section.
Several will I strategy. South edge girl. Form still new reality economic now believe.",zh,ee7aa262-5647-4dee-a124-d542ac4dbb73,b6142e5b-10b1-457d-8a32-f8bd2629eb71,2004-05-02 21:15:37
e9290e51-ad85-4776-a2b8-ceb6f88669bc,https://scott.com/,"But believe I pressure throughout here. Under interview media car. High reach image assume quite.
Lawyer event challenge than pattern. Indeed they seek government drive student. Western task total game.",ar,59ebe9b0-15e2-4eb1-8bdd-f14d1aef82d0,3d58860a-f3c7-4f97-b942-6be6e98fdccd,1982-12-11 05:31:00
b0571f05-b4c3-4cd1-810d-3f36c9cd7877,http://spence.org/,"Town book easy education any nature. Just my spring policy fill. Person chair near course toward someone.
Use growth attack culture. Bag cold computer stuff late. Peace cause beyond probably sound.",zh,7aed1158-fe95-4836-83b3-a76623170038,0fe102a1-a27a-476f-bbac-bd8a9481e3eb,1981-07-23 09:58:52
951f5b67-2837-4eca-8847-066e89b67bcc,http://www.hunt-fuller.info/,"Difference near white maybe have process. Us others your television. Spend all kind hundred at.
Grow pull floor. Soldier occur strategy continue Mrs.",de,bc055d7e-8676-4a0a-9130-4b079f26a5c6,fb95841a-3ebd-4b94-baee-e9a39185ca17,1975-02-13 06:29:51
c53eca27-8610-4985-b514-c2ac8adbbabd,http://www.morgan.com/,"Often agreement brother indicate well industry.
See front occur old. Offer television so value every so rather.
Member these big cut enough mission.
With politics senior imagine themselves. Sound run education challenge can avoid.",de,dd8737a3-3598-4412-bfce-a9aaef3bc7d8,d65da6d8-010c-4d74-9b6e-f91ae4a1e11e,1973-04-21 22:15:00
217c08d3-8eeb-4efb-942e-59084421cf32,https://burke-hernandez.com/,"Be too garden one Mr land. Finally hope on exist mother become.
Important popular ready most than others affect.
Boy build to big difference. Simple activity may firm develop.",en,21f74fde-457d-487a-8dfb-b4a84c6be22c,9ab2ae34-d4c3-42fc-8ad1-aaf223213552,2004-06-03 19:40:13
8f7da27d-428b-4af6-9127-c28aeb73e532,https://www.perry.info/,"Character name Mr inside. Exist enjoy meeting tell. Look newspaper century language adult ever fly. Wife him quickly writer century floor he.
Over very individual type south. Memory box worker art sell.",ru,b0571f05-b4c3-4cd1-810d-3f36c9cd7877,cc5599de-b2b4-4b8b-bc5c-dded69c3e24a,1980-09-16 05:29:25
19bceffa-38fd-4288-8ae5-9196c67c617f,http://murray-mccarty.com/,Check quickly become maintain data suddenly hour. Just resource role arm garden other. Let character table that weight almost.,en,c2d8a2e2-ab43-48e1-a04e-be991c7f0a4d,b648fb03-9215-4dbf-814e-7177b64be1b2,1987-09-24 17:23:19
97d32425-5f8d-4a81-8e56-0d1a1c2adbbf,http://ferguson.info/,"Happen among young stay environment early. Herself through somebody pattern. Have scene human improve community hundred travel.
Certain teacher including car serve outside everything consumer. Item know again century teacher matter vote.",de,19bceffa-38fd-4288-8ae5-9196c67c617f,6828857d-f462-42e4-80aa-5d86f9c4504e,1995-08-17 04:03:39
8f30e15f-b88a-41f7-96b6-e171bc8dd7f2,http://www.johnson.com/,"Bill do event voice. Behind art nation eye knowledge relate. Most artist player record Democrat example where.
Staff over method serious. Past ability people effort whether. Contain left ok available.
Cultural around break suffer PM make doctor war.",zh,08aacca1-4fec-44c2-b8c6-30fc25d8a7ca,55a77259-842f-4567-8837-9ce405e41aff,2008-11-14 17:04:36
00081921-860e-4ba3-b412-1463482d3b4e,https://www.hammond.org/,"Explain room attack. Mr old myself free change. Environment chair maintain store property support.
Action start indeed financial later. Though guess move change raise. Wait across lay present someone daughter business off.",de,c0287509-ef8f-4f6b-9386-41191c407467,9ab2ae34-d4c3-42fc-8ad1-aaf223213552,1988-04-01 18:06:23
016dd805-ba4c-4442-bd4e-3c27e97f93b9,https://www.edwards.info/,"People place development democratic effect police.
Different together take cold something. Budget item bed structure fine. Country month social responsibility enter at brother late.",ar,e118e6d8-ce9e-410d-98e4-24268453bf10,227540fa-c07e-4253-9691-7e66346b0472,1988-06-24 23:21:17
ad164550-a401-4230-9346-c4ba1a62c2ed,http://martinez-blair.com/,"Fast ground space before measure fish send. Fast under stock.
Such five machine example food.
Magazine son price front story. Church foot standard in probably. Memory must trade go water physical blue yeah.
Money now north.",zh,1df3df3e-6998-4122-abbc-4ff36a66db62,051de9f3-5ab2-4a00-ab14-b2df1e0ed7f8,1995-03-11 21:04:24
aa1a27f1-d433-41ac-953a-2677652d6f63,http://www.kelley-zamora.org/,"Sell enough somebody goal individual.
Then any card pretty. Serve determine task power pay. Coach rest start according. Ask scientist establish two beat.
Under community chair make man administration. Free population consider across.",ru,9bbae8c7-72f3-4555-96ad-942a4ced86a0,654bf61c-08e8-42cd-8c0d-a144a761f628,1997-10-26 10:50:14
66440545-cffb-41a3-be1b-8c510a4d52da,http://www.jacobs.com/,"Particularly last weight. Receive morning Mrs nearly eye budget cut. Choose husband day response member their pay five.
Myself produce assume. Wife particularly enjoy provide bar.
Itself just likely someone. Skin senior guy within build spend.",en,21f74fde-457d-487a-8dfb-b4a84c6be22c,4802e4d8-855f-480a-ab65-2eeb8f224b54,2000-05-16 19:18:36
16c607b5-b0ff-4eac-aae0-ff983b2553e4,https://smith.com/,"Candidate station assume. Voice true develop investment.
Oil level out speak industry. Most term seat pattern phone mission explain popular. Two provide center remain.
Relate ground score star each. Rule under think language today show.",de,3fe7e4b2-5e5e-4348-adcc-f74c9451b1e7,3d58860a-f3c7-4f97-b942-6be6e98fdccd,2018-11-19 23:52:44
