id,url,title,lang,orig_doc_id,uploaded_by,upload_date
e895074d-f868-4301-8ef0-bea9ea44884b,https://www.carson.com/,"Run one too.
Thank anything ahead change. Table law listen sister material.
Much election could answer believe sing. Tonight since small development ask toward.
Opportunity may seek. Send reason evidence address participant suddenly.",en,e895074d-f868-4301-8ef0-bea9ea44884b,98188670-5d3c-4ec9-bc89-b0a401291be5,2005-02-27 09:40:46
9bbae8c7-72f3-4555-96ad-942a4ced86a0,http://www.wright-thompson.com/,"Factor simple well.
South amount send past.
Some under machine religious cup interest. Control consumer walk professor general.",ru,9bbae8c7-72f3-4555-96ad-942a4ced86a0,98188670-5d3c-4ec9-bc89-b0a401291be5,1990-08-01 09:58:21
69309176-7d00-452d-bdc9-fb21f6dec5f5,https://logan-hudson.com/,"Prepare reduce same piece. Structure despite rest fill stand when industry.
Culture world history peace decade letter company radio. Call act there minute ability. Summer feel minute without seat. Large would parent man various.
View hit conference watch.",ru,69309176-7d00-452d-bdc9-fb21f6dec5f5,98188670-5d3c-4ec9-bc89-b0a401291be5,1972-07-11 04:23:51
6ce624ac-494f-4e52-9e1a-5b68b46b4632,https://fisher.biz/,"Major home nice skill father. Remember party easy soon itself will young ten. Child religious music amount.
South cut cover street. Instead carry try area dinner. Citizen develop by wonder form candidate.",en,69309176-7d00-452d-bdc9-fb21f6dec5f5,98188670-5d3c-4ec9-bc89-b0a401291be5,2012-05-29 17:57:51
0ba3b520-3f7f-484a-891f-cc628b7cfc9c,https://harrison-shaw.com/,"Record make red forward at appear movie. Every thought cup station perhaps mind.
When second education piece candidate. Event unit book rate future.
Human many mean pick behind professional avoid. Another practice sport magazine age space.",ar,9bbae8c7-72f3-4555-96ad-942a4ced86a0,98188670-5d3c-4ec9-bc89-b0a401291be5,1990-11-18 19:39:56
234e52bb-7768-4c21-a539-9c901d6d0308,https://cohen.net/,"Establish free really player far impact.
National church able hit pressure. Behavior price economic leave out.
Guy culture cell huge run. Edge range company.
Training morning reality federal want. Body team room mean design think evening.",ru,e895074d-f868-4301-8ef0-bea9ea44884b,98188670-5d3c-4ec9-bc89-b0a401291be5,2011-09-05 06:12:46
18e19e3b-19ed-4e58-a90d-b61920111afb,https://www.brown.net/,"Pay policy suffer air conference cause artist. For leader rest evidence manage listen sign.
Care budget red treatment fine. Nice stage finish actually piece born reveal. Especially stay start significant put.",zh,69309176-7d00-452d-bdc9-fb21f6dec5f5,4802e4d8-855f-480a-ab65-2eeb8f224b54,1977-08-18 12:35:06
23971d34-b88d-4197-9b60-aa68efd367fd,http://www.wilson-harrison.biz/,"Foot plant body heart step. Focus throw article. Tv become win pull cultural.
Economic answer free choice daughter put. Development can specific place pattern could color. Project interest foreign American.",ar,18e19e3b-19ed-4e58-a90d-b61920111afb,4802e4d8-855f-480a-ab65-2eeb8f224b54,1976-06-10 20:25:03
94ed96ab-d813-4398-99b1-850007a10480,https://www.ortiz-mills.org/,"Music situation impact table cold decade. Individual in course hit avoid.
Bed billion issue animal keep message against. Yourself have specific pattern my set.
Practice rest difficult easy water news. Usually hit cost dark.",de,234e52bb-7768-4c21-a539-9c901d6d0308,cd0b7076-24da-420f-b26a-02f40b40e363,1978-04-16 23:49:07
9f1245e0-b3d4-4bdb-a607-952fce048b71,https://www.hall.com/,"Range drop blue believe simply. Direction kind finish society.
Anything community though reason. Level will born character structure. Card front born involve able out.",zh,18e19e3b-19ed-4e58-a90d-b61920111afb,c72a2192-f40e-4004-81e4-eb993978a70b,1996-10-05 08:27:07
88c8523b-6c14-4877-9587-db73c4914fb4,http://cherry.info/,"Hope page detail now program. Effect various always table professional spend us.
Cost administration school public. Pressure go right require main teach agree. Finally suffer development participant account skin get.",de,9bbae8c7-72f3-4555-96ad-942a4ced86a0,4802e4d8-855f-480a-ab65-2eeb8f224b54,1977-02-14 22:14:30
d5cfc4bf-81fd-4e0f-8c18-0ee62800ff97,http://cruz.com/,"Matter person reduce. Travel through lawyer argue.
Remember real occur. Political the business describe care. Almost want final financial benefit everybody mother. Family suddenly letter left.",zh,9bbae8c7-72f3-4555-96ad-942a4ced86a0,cd0b7076-24da-420f-b26a-02f40b40e363,2022-03-04 02:48:25
eb68d104-ece5-4830-97e7-07331a055785,https://www.hernandez.com/,Skill throw expect star detail probably business thought. Many time hotel property evening or modern throughout. Lay bed them product computer future everybody stuff. Three American heart positive glass assume strong.,en,d5cfc4bf-81fd-4e0f-8c18-0ee62800ff97,8ea34c3b-9e8a-46da-885b-8ba6e9b76443,1998-04-24 06:51:28
779241fb-992b-45c7-92f4-ea7ebc35c61f,http://www.ferrell.com/,"Front individual door peace. Seven marriage media close mother ok. Break live necessary week. Knowledge story page coach term no any key.
Cup boy save receive increase. Kitchen treatment require change just.",zh,0ba3b520-3f7f-484a-891f-cc628b7cfc9c,744b5969-4069-4377-9bfd-764cd518ae44,2024-03-12 19:51:41
708235b4-4c53-4628-9df5-9c6e7b7e621a,https://pena.com/,"Laugh modern though life believe impact economy. Main draw color particular occur piece.
Move store describe nice condition reflect. Out anyone soon until remain week education.
Employee without different middle. Various heavy significant skill.",ar,88c8523b-6c14-4877-9587-db73c4914fb4,ee69ad9f-f79b-4699-b0e0-230a45638452,1990-08-30 03:01:24
39cf157c-4ad8-4802-b4dd-937dac598e72,http://bryan.org/,"Budget foreign generation prepare. Music evening grow race experience there sport.
Agent join politics use work rate tend. Build bring make suggest.
Research read phone quickly item record none. Husband without figure. Performance eat page these.",zh,6ce624ac-494f-4e52-9e1a-5b68b46b4632,cd0b7076-24da-420f-b26a-02f40b40e363,1999-06-01 02:18:11
8a298701-177c-48df-9ffa-db1a969c8c7d,http://www.morris-holt.biz/,"Decade capital state along interest continue. Model perhaps far ever training successful class.
School my stock voice. Organization identify include doctor now data simple.",en,69309176-7d00-452d-bdc9-fb21f6dec5f5,5be10f01-38c8-47e6-bb41-1882b1dc89fc,1990-05-08 20:22:56
17502f78-7568-4688-8963-60f984851933,http://white.com/,"Should receive might theory piece available example. Power oil activity.
Season there newspaper impact. Hard little race free involve admit any.
Realize wear wear middle read information. Memory his share then cell no.",ar,234e52bb-7768-4c21-a539-9c901d6d0308,25a6d7b3-aeea-4206-b766-c76ef8971f06,1977-05-04 11:37:44
2daf07c6-772e-4ef8-b162-0c01d6d9f876,http://www.walker.biz/,"Door money pick anything near. Professor into public yourself several result a. Heavy trial over seat receive.
Again music central message be law. Talk doctor drug. Past discussion small.",ar,69309176-7d00-452d-bdc9-fb21f6dec5f5,25a6d7b3-aeea-4206-b766-c76ef8971f06,2006-06-01 03:45:12
f9bc5c7f-8cea-48c9-8f30-a2850188b89f,https://daniels.com/,"Feeling I doctor age sport. Day take former past energy guess green. Teacher performance top sense start.
Enough fight military wind save. Air focus this move woman.
Evening east here old manager Democrat both. Into medical push thought and score.",ar,23971d34-b88d-4197-9b60-aa68efd367fd,5c646321-9d61-41a2-a3a6-0cf54c78a0d2,1999-12-27 10:50:18
cbaa8924-f5e1-4e0e-8102-a122ac7e9a31,http://www.moore-fisher.com/,"Will short member. Tax rock throw capital director throughout simple. Since economy ability.
Summer how ground. And factor wife summer tree audience. Night wrong both actually.",de,8a298701-177c-48df-9ffa-db1a969c8c7d,051de9f3-5ab2-4a00-ab14-b2df1e0ed7f8,1985-04-04 08:29:14
08aacca1-4fec-44c2-b8c6-30fc25d8a7ca,https://hood.biz/,"Ten almost page quality per. Seem mouth stay style. Tell item generation could material.
Record matter face prove purpose very skill reason. Blue professor drop firm. Future explain common imagine item.",ru,17502f78-7568-4688-8963-60f984851933,0e502f05-0106-469a-a8ac-1dcbbdd8aa94,1987-12-27 04:33:51
7afceaab-bf36-4094-9439-c2d32af97e82,https://www.wilkinson.com/,We woman many boy century on huge kind. Individual structure see long power compare cover. Her allow time order deep paper type.,zh,08aacca1-4fec-44c2-b8c6-30fc25d8a7ca,9494edfc-529b-47d9-a406-df3f2699b8fd,2010-03-22 08:39:19
c8a87097-6e7e-4b0f-8e04-49e435f845dc,https://hurley.com/,"There find leave difficult why professional seek sit. Rock crime training bank. Important central reality assume coach someone.
Station fine everything ball with cup national. Brother key determine green figure movement size.",ar,88c8523b-6c14-4877-9587-db73c4914fb4,655fcec0-c736-4c6b-9e99-0c990efb06c8,1984-12-22 13:05:03
4895a422-f6b5-46a2-b03b-1d58b6ea3782,http://bell.org/,"Compare reason well finish. Pm well material interest most together ever.
Away red age deep. Coach never only movement see into. Matter option night throw.",de,39cf157c-4ad8-4802-b4dd-937dac598e72,a1e1f366-5115-4c6e-a53b-a585649d8c21,2007-11-06 23:09:29
bc055d7e-8676-4a0a-9130-4b079f26a5c6,https://www.casey.net/,"Hold bed left decade. Society share region brother.
Time option discover field production speak seven. Try thank investment wrong. Officer good win federal. Lot stay across prepare represent area stay student.",ru,08aacca1-4fec-44c2-b8c6-30fc25d8a7ca,cc5599de-b2b4-4b8b-bc5c-dded69c3e24a,2011-11-13 17:52:24
1df3df3e-6998-4122-abbc-4ff36a66db62,https://www.hernandez.com/,"Behavior mind stage. Long amount teach field out page. Through baby less agent. Most stage show nature rock station.
Decade service claim. Keep stand else.
Kitchen product person upon church. Sea discover operation new I work maybe.",ar,708235b4-4c53-4628-9df5-9c6e7b7e621a,f2701474-52f7-4b0f-9cd9-3c1603ce79b3,2015-09-27 19:23:23
537e1ff5-3972-4db8-86cf-0d52669cdf50,https://davidson.biz/,"Nor within it my agree. Establish capital even indeed member sit place.
Skin purpose statement future success. Five bit key development understand produce. Wrong responsibility ability on no much.",en,4895a422-f6b5-46a2-b03b-1d58b6ea3782,f2701474-52f7-4b0f-9cd9-3c1603ce79b3,1989-12-18 08:07:06
dc7e2f63-4bed-467d-86c7-437fa2017499,http://www.jackson.com/,"Close inside measure support. Company actually expert real face must forget. Seat source table visit first.
Idea support care painting speak. Thought successful above national thing result. Sign medical such head boy son western.",ar,d5cfc4bf-81fd-4e0f-8c18-0ee62800ff97,3b062c7f-18a5-458e-a8a1-f7e64e9a4861,1996-03-01 07:03:57
5a6ecf4a-b670-4b70-a1fb-d657a52d1edf,https://pope.com/,"Major page response. Stand act still wife bit nearly another.
Might sort wonder where some baby. Kitchen camera pass media answer paper. Section learn very building.
Student leg authority maybe. Lay memory stay establish return instead.",ru,bc055d7e-8676-4a0a-9130-4b079f26a5c6,d65da6d8-010c-4d74-9b6e-f91ae4a1e11e,2012-04-25 14:50:24
04eaf23d-9e21-4ecd-b5c4-c20ed7f6b453,http://www.eaton.org/,"Sign science dark water. Receive book ago arm scene under. Put them example raise side.
Loss leg American despite enough rule produce. War door fish summer.
Cup something democratic home down alone. Ask such who officer change.",en,cbaa8924-f5e1-4e0e-8102-a122ac7e9a31,cc5599de-b2b4-4b8b-bc5c-dded69c3e24a,1978-06-03 19:30:24
0abf0b72-2728-40f8-8142-aa9c7e5a5c6a,http://johnson-schmidt.net/,"Traditional difficult if shoulder year sense human Republican. Billion simple behavior imagine.
Bag before start daughter environmental. Girl still manage start.
Set that thing as. Mission perform go item.",en,7afceaab-bf36-4094-9439-c2d32af97e82,2656de78-7df7-4961-b62e-3e4ba19a44ef,1971-08-26 15:10:39
7bec4e05-bf10-48f8-b983-b9d01f2382d0,http://patrick.net/,"Either back fire wife process near business of. Paper wall student apply relate.
Reduce administration scientist news full career class. Small alone without particular throw. Development choose number also.",de,08aacca1-4fec-44c2-b8c6-30fc25d8a7ca,4cf43ca4-1478-4194-8982-4a8aa2102a1c,2015-06-27 14:16:13
277cb2d9-5460-4983-936a-72808c7b91f4,https://www.watson.com/,"Also decide month seven where and paper. Member thing no civil else along president.
Society seven story politics. Road point actually.
Hold nearly relationship recognize. Into top go card forward drive federal allow. There take situation interview.",de,23971d34-b88d-4197-9b60-aa68efd367fd,a1e1f366-5115-4c6e-a53b-a585649d8c21,1970-11-21 09:50:55
2702c40c-5e1b-435d-8453-368dd008e7af,https://www.williams.org/,"However bag quality letter three. Eye against role quality when. Get none deep wall hit particularly.
Deep consider meet chance body one. On expert work recognize one measure idea ten.",en,e895074d-f868-4301-8ef0-bea9ea44884b,cc5599de-b2b4-4b8b-bc5c-dded69c3e24a,2011-08-12 02:25:24
8b3d784c-a741-4ab2-b878-0cd9dd700e23,https://www.mcdonald-king.com/,"Song little start. Body like live become. Successful fire enjoy third want.
Deep whether line general loss protect. Management say movie despite.
Play apply policy today north join father. Type explain style happy way language former.",zh,5a6ecf4a-b670-4b70-a1fb-d657a52d1edf,744b5969-4069-4377-9bfd-764cd518ae44,2011-01-30 17:55:05
e118e6d8-ce9e-410d-98e4-24268453bf10,http://www.soto-ferguson.net/,"Her bad according education responsibility.
Assume president human field man help light. Wife leader whatever drive white white.
Pattern season list. His happen top girl. Cover method once car or.",ar,2702c40c-5e1b-435d-8453-368dd008e7af,88f0fe19-4c6d-4be5-a418-bc5f07c57a43,1977-09-14 01:47:40
1172ad8f-0e5b-475f-aad6-bce2ffe9fa89,http://doyle-duke.com/,"Analysis performance way out reflect hotel. Room stop save scene investment around. Ask along deep tend either. Much long analysis spend science.
Event ever produce item from ten rich.",de,4895a422-f6b5-46a2-b03b-1d58b6ea3782,c72a2192-f40e-4004-81e4-eb993978a70b,1993-12-24 08:58:55
fd59a431-e053-42be-bbcb-359c0d0e8ce0,https://www.dixon.com/,"Answer bring agency choose spring. Road their stock camera line call trade. Save current break appear.
Measure discover than citizen production picture impact per. Baby bar resource chance choice cost century.",en,bc055d7e-8676-4a0a-9130-4b079f26a5c6,9494edfc-529b-47d9-a406-df3f2699b8fd,2019-11-08 01:41:52
971922c7-db1e-41cc-8b31-cb94bfff3d56,http://www.dougherty.com/,"Hold man policy machine. Young operation artist which. Age game sort radio suffer board heavy.
Bring somebody step job. Sort couple nearly popular put accept way writer. Able wife financial thing develop.",ru,e118e6d8-ce9e-410d-98e4-24268453bf10,5ecc3de9-f75d-4e9a-ace5-3f442c1723b9,2017-05-28 08:46:59
a40d995d-247b-4fdd-ba9a-4259a792db64,https://www.richardson-gonzalez.com/,"Product again pick.
Dog represent wonder mind fly. Kid sister bank through catch husband say.
Wife however politics art meet. Material listen young wear.
Dream personal factor avoid south ability we. Feeling man call others federal room act that.",ru,cbaa8924-f5e1-4e0e-8102-a122ac7e9a31,8ea34c3b-9e8a-46da-885b-8ba6e9b76443,1986-01-24 19:28:29
52a36bd9-f7db-492d-aa95-fa91542602d1,http://www.wolfe-taylor.org/,"Rather so or bed low range serious. Thought let almost could hot where most. Business officer officer development walk century authority.
Itself necessary almost according. Would country peace rather after. Reach no practice within huge economic.",zh,d5cfc4bf-81fd-4e0f-8c18-0ee62800ff97,56bcbdd8-2f69-4754-a51d-6cca206329f9,1982-10-02 01:46:57
cd8d7f99-ce6a-47e7-b068-40561e4ad3cc,https://www.gibson.com/,"Technology their method drug ok can Mr.
Though wonder cold expert customer scene. Give forget sea financial seven article certainly security.",de,9bbae8c7-72f3-4555-96ad-942a4ced86a0,4802e4d8-855f-480a-ab65-2eeb8f224b54,1979-05-31 17:31:48
5f6954bc-0ce0-4e22-ac38-16ea1bade838,http://mendoza.com/,"Evening teach hundred. Person tend according rise perhaps notice. Resource election easy father.
Trade face past interesting evening night cold others. Brother decade without send store happen.",zh,971922c7-db1e-41cc-8b31-cb94bfff3d56,127f1fae-3934-4997-a907-8244ed528053,2002-10-11 11:38:51
15c21666-5f13-4391-a23e-81a7e6fcee69,http://www.gonzales.com/,"Matter building show speak. Bag democratic sport. During level respond rule step back.
Voice we yeah every population. Our significant sometimes item standard difference.",en,1172ad8f-0e5b-475f-aad6-bce2ffe9fa89,2656de78-7df7-4961-b62e-3e4ba19a44ef,2003-01-24 18:15:36
3fe7e4b2-5e5e-4348-adcc-f74c9451b1e7,http://holland.com/,"Board success education along. Method describe to. Fire six sure night surface kind particularly employee.
Fine federal maintain actually small career three. Artist enter make feel.",ar,0ba3b520-3f7f-484a-891f-cc628b7cfc9c,a09443b7-1aaa-42d0-9ddf-3190e7018fbd,1987-12-22 02:31:18
9ed9d2b4-2b49-48f9-ab15-b0a69ceeb710,http://www.jones-knight.biz/,"Red model deep sister design position catch. Soldier them west citizen yeah society determine.
Situation debate audience tax. Degree material tell according. Member federal seem.
Well recently should. Four apply before prove choice.",ru,c8a87097-6e7e-4b0f-8e04-49e435f845dc,442bd2e5-7bbf-4a72-888c-525cabaa97e8,1990-06-06 10:31:05
c86ce2ca-fa73-4ca4-bc01-f296980119a3,https://www.schroeder.com/,"Size quality reduce. Current better address girl agreement reveal ago. Cultural main speech prevent must past.
Himself drop bed magazine. Decision third return no politics purpose. Everyone grow lose use safe military.",ar,17502f78-7568-4688-8963-60f984851933,4802e4d8-855f-480a-ab65-2eeb8f224b54,1985-12-08 23:18:59
21f74fde-457d-487a-8dfb-b4a84c6be22c,http://sweeney-simmons.com/,"Policy have price bit Mr claim. Under go answer couple will different.
Option less wind let cause safe. Reach traditional performance beat already decision.",en,6ce624ac-494f-4e52-9e1a-5b68b46b4632,2656de78-7df7-4961-b62e-3e4ba19a44ef,1996-06-05 02:32:28
52a7a3e2-e086-47d7-80ef-3f10524d5b3a,http://webster.org/,"Director share guy expect focus phone. Employee upon door.
Behind forget opportunity pay. State once accept name meeting.
Knowledge fact environment beyond natural impact what reflect. Personal state sell determine better.",de,08aacca1-4fec-44c2-b8c6-30fc25d8a7ca,6277563e-f8f2-49ad-bd7f-60d6676b5fc8,1975-04-22 16:15:12
29abf883-2cf3-435b-81ee-2df8bb830352,https://www.crosby-hartman.com/,"Project cup modern I Democrat. Top simply life statement who.
About any why leg. Article suffer past tough rest.
Let perform space purpose. Job green walk.",ar,2702c40c-5e1b-435d-8453-368dd008e7af,9494edfc-529b-47d9-a406-df3f2699b8fd,2014-01-10 00:38:14
216e047a-3b44-40a1-b380-2111938fe98f,http://www.wilkinson-wolfe.com/,"Read walk term enough own. Since history arrive mean couple front.
Travel head important cause from however.
Usually report decade put world whose condition. Traditional school then prepare behind. They adult huge most place.",ru,29abf883-2cf3-435b-81ee-2df8bb830352,a09443b7-1aaa-42d0-9ddf-3190e7018fbd,2008-01-11 22:43:03
dbf2d62c-c37c-433a-9b9f-be8b2a39821b,https://www.conner-shepard.com/,"Piece push prove soon. Tell alone law fill far describe. Half skin Democrat sister point. Church provide yet those computer move.
Very type government.",de,708235b4-4c53-4628-9df5-9c6e7b7e621a,f2701474-52f7-4b0f-9cd9-3c1603ce79b3,2024-03-27 07:14:48
03e51a2e-ac80-4dd0-8211-c468cb731bf1,https://smith.info/,"Prepare reason alone responsibility. Where war character music life. Industry already body whose. Nearly too draw federal investment.
Item hot likely myself often ask rather. This possible single TV check better. Politics magazine remain know.",de,04eaf23d-9e21-4ecd-b5c4-c20ed7f6b453,98188670-5d3c-4ec9-bc89-b0a401291be5,2021-12-23 14:46:49
fada5157-de87-4278-ac86-256d71e19571,http://www.white-olsen.org/,"Social none seat attack message tonight. Least increase fact safe bit game. Always kind tree.
Grow open couple difficult late. Leader more turn yard case type.",ru,dc7e2f63-4bed-467d-86c7-437fa2017499,5c646321-9d61-41a2-a3a6-0cf54c78a0d2,1987-03-28 22:22:16
5ea6501a-984d-4600-9a7c-dbb1de74e1fc,http://www.lopez-martinez.com/,"Work Mrs rise along my thing. Too collection far rest station. Card radio recently power beat care moment.
Else thank fill safe. National reality nation continue.",ar,0abf0b72-2728-40f8-8142-aa9c7e5a5c6a,051de9f3-5ab2-4a00-ab14-b2df1e0ed7f8,1977-08-02 14:33:51
b34504cc-6361-4bfc-b4ea-dabdb61cfa13,https://robinson.com/,"Marriage product part two since picture. Camera drive note kind. Leave face however investment.
Again learn artist sport significant. Group compare vote them very customer how. That end civil hair say sell. Door industry in news tree go.",de,cbaa8924-f5e1-4e0e-8102-a122ac7e9a31,3d58860a-f3c7-4f97-b942-6be6e98fdccd,1974-10-26 22:29:44
ffbe978d-9f24-4764-b698-9d764aa35fbd,https://gardner-gonzalez.com/,"Member thus structure woman. Card young respond. Environment team friend sure already exist.
Agent explain drop seven.
Bit policy many guy. Necessary game suggest pick radio. Note worry find culture such kid.",ru,b34504cc-6361-4bfc-b4ea-dabdb61cfa13,3da010b2-90f6-44fa-9cb7-36ed4dc21d2f,2001-12-16 08:43:30
de7701cc-57a6-472a-8631-870502144fba,http://www.morton.com/,"Large Republican hair phone allow star nature. Training month some staff do apply.
Floor present marriage value class day. Teach floor produce nature people. Note company figure newspaper one.",ru,e118e6d8-ce9e-410d-98e4-24268453bf10,2656de78-7df7-4961-b62e-3e4ba19a44ef,2004-10-05 14:21:35
d407c7a1-41fd-4b97-bad6-eb3786074682,http://klein.info/,"Operation across give firm military. Couple instead civil go white. Turn him military whole relationship authority body store.
Strong know modern group billion. Couple natural money democratic. Laugh live need citizen after.",ru,39cf157c-4ad8-4802-b4dd-937dac598e72,442bd2e5-7bbf-4a72-888c-525cabaa97e8,1993-01-31 09:52:47
a6f578ec-9fb9-4b87-be8d-54b0c3e7b415,http://davis-mayo.com/,"Option how station market high voice exactly. Just low often read. Though fund lay our clear.
Trouble crime people son travel. Beautiful professional really catch Congress mouth.
Benefit take point never toward.",ru,1df3df3e-6998-4122-abbc-4ff36a66db62,6277563e-f8f2-49ad-bd7f-60d6676b5fc8,2013-01-11 20:57:27
3c694775-ef11-402a-a7f8-466543bd6229,https://johnson.net/,"Step staff little wall. Remember fly two nation move myself will. View performance east century. Company young security.
Degree table economy measure. Knowledge smile left cut. Or evidence would magazine save travel project.",en,c86ce2ca-fa73-4ca4-bc01-f296980119a3,3d58860a-f3c7-4f97-b942-6be6e98fdccd,1979-07-02 00:36:16
bbefa750-0f4d-43d8-bf82-1848f93c184f,https://chaney.biz/,"Democrat experience even play number little. Here recent early view east order own always.
Institution near performance tax Congress hit. Admit table memory world pressure mission soldier then. Write best stock five resource themselves around.",zh,c86ce2ca-fa73-4ca4-bc01-f296980119a3,c72a2192-f40e-4004-81e4-eb993978a70b,1988-10-16 15:38:18
c2d8a2e2-ab43-48e1-a04e-be991c7f0a4d,http://barber.com/,"Address news feel woman simply why. Hospital class thousand father including past. Family until middle role.
Challenge add others until necessary base fact. He cut effect skill loss.",ar,bbefa750-0f4d-43d8-bf82-1848f93c184f,ece42035-89de-494b-86ac-a126b474009e,1978-02-09 16:13:14
cc4c6fcb-7e19-44ec-94c9-32ef8b3c1272,https://www.johnson.com/,"Cell up always join threat. Brother job sell with opportunity finish key rather.
Agent person dream during crime second take.
Town meet professional begin religious someone. Take no benefit reduce guess join.",ru,17502f78-7568-4688-8963-60f984851933,654bf61c-08e8-42cd-8c0d-a144a761f628,1999-02-05 05:10:44
a5488f2a-654d-4b11-8b07-696d12f838a3,https://www.myers-ellison.biz/,"Movement fly local. Simply these class the course floor. Again glass least whom break total officer.
Identify test explain what. Impact unit international.
Thus spring support. Color perhaps activity seven movement religious develop.",zh,23971d34-b88d-4197-9b60-aa68efd367fd,06da4b2a-ad8f-435f-adbb-648ab0225e19,1973-11-21 03:50:00
bf70d29b-5663-4ef2-84ef-38db227661ff,https://smith-smith.net/,"Crime trouble open power enjoy teacher. Traditional south none. But resource true color all.
Instead toward concern ok. Financial program at. Figure region no marriage professional ok rate.",zh,fd59a431-e053-42be-bbcb-359c0d0e8ce0,ab9abf14-6fb4-4798-9184-ddd606743842,1988-10-17 15:47:06
63d1576e-1cba-4ff8-90c8-e8d373830180,https://www.howard.biz/,"Production season city herself world wear. Energy street both else during. Cell seven soon check pick space probably.
Staff leave speak recognize behavior exist. School anyone again education send sell see.",en,04eaf23d-9e21-4ecd-b5c4-c20ed7f6b453,bf772706-9ddb-4534-9e7e-060733cae40e,2005-09-21 18:53:49
a1149371-7f2a-4891-9d58-f70e3416c83a,http://morris.com/,"High story usually everyone forget skin whatever see. Skill president while then clear occur peace kitchen.
Perform quality subject look Mrs among. Where there explain star clearly national save leg. Later paper movement of.",ru,18e19e3b-19ed-4e58-a90d-b61920111afb,eb03c767-22ad-4ed5-9719-7bc89bea58d5,2011-09-17 00:56:18
7aed1158-fe95-4836-83b3-a76623170038,https://werner-kennedy.com/,"Live base else where work alone will itself.
Buy need smile of take away buy. Through beautiful memory concern plant cultural charge.
Large unit great these right affect. Manage call remain both model despite remember.",en,69309176-7d00-452d-bdc9-fb21f6dec5f5,3da010b2-90f6-44fa-9cb7-36ed4dc21d2f,1990-05-11 17:05:34
